Priority,Sport,Segment,Creator,Platform & Handle,Followers,Style,Why fit
Low,Football,College (culture+gaming),Lacey Jane Brown,TikTok @laceyjanebrown,~614k TikTok,CFB fan-culture humor,Broad casual reach beyond the sim-gamer niche
Low,Football,Round 2 (Madden/CFB/NFL),RBT,YouTube @RBT,~1.4M YT,Long-form Madden & CFB dynasty/rebuild,"Exact-audience match; larger reach, pricier"
Low,Football,Round 2 (Madden/CFB/NFL),Toke,YouTube @Toke (MaddenGOAT),~749k YT,Madden MUT + franchise,"Madden reach, but MUT-heavy = looser fit"
Low,Soccer,EA FC / Football Manager,Ben Black,TikTok @benblack; IG/YouTube,~26.8M TikTok,Soccer challenges/culture,"Enormous reach, out of budget; note for scale-up"
Low,Soccer,EA FC / Football Manager,ChrisMD,YouTube ChrisMD,~6.3M YT,FIFA gameplay + IRL challenges,Great fit but too expensive
Low,Soccer,EA FC / Football Manager,NepentheZ,YouTube @NepentheZ; Twitch,~1.96M YT,"EA FC Ultimate Team, ex-pro",Massive UT audience; above budget except a small integration
Low,Soccer,EA FC / Football Manager,Tifo Football,YouTube Tifo Football,~1.76M YT,Tactics/analysis explainers,Analytical audience fits ratings depth but brand-owned + pricey
